{
  "schema": "passdown.result/v1",
  "attempt": "pd-20260921T101530Z-3f9a1c2e",
  "disposition": "blocked",
  "summary": "The sandbox denied the Gradle cache write.",
  "changed_paths": [],
  "evidence": [
    {
      "kind": "command",
      "command": "./gradlew test",
      "exit_code": 1,
      "observed": "Operation not permitted"
    }
  ],
  "question": null,
  "blocker": {
    "kind": "sandbox",
    "message": "open /Users/x/.gradle/caches: operation not permitted"
  }
}
